{
  "schemaVersion": "1.0.0",
  "authority": {
    "outlineId": "outline:light-delay-master-narrative",
    "scriptId": "script:light-delay-master-narrative",
    "continuityId": "continuity:light-delay-master-wip",
    "status": "wip_authoritative"
  },
  "deletionGates": [
    { "id": "master_outline_complete", "status": "open" },
    { "id": "salvage_review_complete", "status": "open" },
    { "id": "replacement_derivatives_approved", "status": "open" },
    { "id": "no_active_dependants", "status": "open" }
  ],
  "defaults": {
    "unclassifiedStatus": "review_required",
    "unclassifiedRelevance": "uncertain",
    "unclassifiedDisposition": "retain"
  },
  "groups": [
    {
      "id": "lifecycle:master-authority",
      "status": "active",
      "relevance": "authoritative",
      "disposition": "retain",
      "reason": {
        "es": "La escaleta maestra bilingüe es la fuente narrativa vigente aunque continúe en desarrollo.",
        "en": "The bilingual master outline is the current narrative source even while it remains in development."
      },
      "refs": [
        { "kind": "project", "id": "project:light-delay" },
        { "kind": "continuity", "id": "continuity:light-delay-master-wip" },
        { "kind": "script", "id": "script:light-delay-master-narrative" },
        { "kind": "outline", "id": "outline:light-delay-master-narrative" }
      ]
    },
    {
      "id": "lifecycle:master-empty-surfaces",
      "status": "active",
      "relevance": "platform",
      "disposition": "retain",
      "reason": {
        "es": "Ruta vigente que representa honestamente que todavía no existe implementación derivada del master.",
        "en": "Current route that honestly represents that no implementation has yet been derived from the master."
      },
      "refs": [
        { "kind": "animatic", "id": "script:light-delay-master-narrative" }
      ]
    },
    {
      "id": "lifecycle:master-festival-derivative",
      "status": "active",
      "relevance": "required",
      "disposition": "retain",
      "reason": {
        "es": "Derivado Festival WIP autorizado y fijado a la revisión 19 del master; contiene escaleta, relato de audiencia inglés y un stub de guion vacío.",
        "en": "Authorized Festival WIP derivative pinned to master revision 19; it contains an outline, an English audience narrative, and an empty screenplay stub."
      },
      "refs": [
        { "kind": "script", "id": "script:light-delay-festival-master" },
        { "kind": "outline", "id": "outline:light-delay-festival-master" },
        { "kind": "static_file", "id": "docs/wip/festival-cut-screenplay-runway.en.md" },
        { "kind": "static_file", "id": "docs/wip/festival-cut-audience-narrative.en.md" },
        { "kind": "static_file", "id": "docs/wip/festival-cut-audience-narrative.voices.en.md" },
        { "kind": "static_file", "id": "data/production/audio/festival-audience-dialogue-performance.json" },
        { "kind": "static_file", "id": "data/production/audio/audience-narratives.json" }
      ]
    },
    {
      "id": "lifecycle:current-editorial-contracts",
      "status": "active",
      "relevance": "platform",
      "disposition": "retain",
      "reason": {
        "es": "Contrato, estado o derivado vigente que gobierna la autoridad maestra y su manejo seguro.",
        "en": "Current contract, status record, or derivative governing the master authority and its safe handling."
      },
      "refs": [
        { "kind": "static_file", "id": "AGENTS.md" },
        { "kind": "static_file", "id": "README.md" },
        { "kind": "static_file", "id": "TODO.md" },
        { "kind": "static_file", "id": "CHANGELOG.md" },
        { "kind": "static_file", "id": "data/README.md" },
        { "kind": "static_file", "id": "docs/ADR-0001-MULTI-SCRIPT-CONTINUITIES.md" },
        { "kind": "static_file", "id": "docs/ADR-0002-MASTER-NARRATIVE-AUTHORITY.md" },
        { "kind": "static_file", "id": "docs/ESCALETA.md" },
        { "kind": "static_file", "id": "docs/GUIA_ESCALETA.md" },
        { "kind": "static_file", "id": "docs/JSON_FORMAT.md" },
        { "kind": "static_file", "id": "docs/JSON_FORMAT_I18N_ADDENDUM.md" },
        { "kind": "static_file", "id": "docs/PROJECT_STATUS.md" },
        { "kind": "static_file", "id": "docs/MASTER_RELEVANCE_REPORT.md" },
        { "kind": "static_file", "id": "docs/PENDING_AUTHOR_NOTES.md" },
        { "kind": "static_file", "id": "docs/WORKFLOW.md" },
        { "kind": "static_file", "id": "docs/wip/continuity-review.es.md" },
        { "kind": "static_file", "id": "docs/wip/continuity-review.en.md" },
        { "kind": "static_file", "id": "docs/wip/general-narrative-outline.es.md" },
        { "kind": "static_file", "id": "docs/wip/general-narrative-outline.en.md" }
      ]
    },
    {
      "id": "lifecycle:deprecated-products",
      "status": "deprecated",
      "relevance": "unrelated",
      "disposition": "retain_for_salvage",
      "reason": {
        "es": "Producto anterior al master vigente. Se conserva para rescatar diálogo, encuadres y procedencia; no puede guiar trabajo nuevo.",
        "en": "Product predating the current master. It is retained to salvage dialogue, framing, and provenance; it cannot guide new work."
      },
      "refs": [
        { "kind": "continuity", "id": "continuity:light-delay-primary" },
        { "kind": "script", "id": "script:light-delay-main-short" },
        { "kind": "script", "id": "script:light-delay-festival" },
        { "kind": "script", "id": "script:light-delay-trailer" },
        { "kind": "script", "id": "script:light-delay-long" },
        { "kind": "outline", "id": "outline:light-delay-main-short" },
        { "kind": "outline", "id": "outline:light-delay-festival" },
        { "kind": "outline", "id": "outline:light-delay-trailer" },
        { "kind": "outline", "id": "outline:light-delay-long" }
      ]
    },
    {
      "id": "lifecycle:obsolete-implementations",
      "status": "obsolete",
      "relevance": "unrelated",
      "disposition": "retain_for_salvage",
      "reason": {
        "es": "Implementación o planificación ligada exclusivamente a productos narrativos deprecados. Se conserva hasta completar el rescate.",
        "en": "Implementation or planning tied exclusively to deprecated narrative products. It is retained until salvage is complete."
      },
      "refs": [
        { "kind": "animatic", "id": "script:light-delay-main-short" },
        { "kind": "animatic", "id": "script:light-delay-festival" },
        { "kind": "animatic", "id": "script:light-delay-trailer" },
        { "kind": "animatic", "id": "script:light-delay-long" },
        { "kind": "production_plan", "id": "script:light-delay-main-short" },
        { "kind": "production_plan", "id": "script:light-delay-festival" },
        { "kind": "production_plan", "id": "script:light-delay-trailer" },
        { "kind": "production_plan", "id": "script:light-delay-long" },
        { "kind": "continuity_ledger", "id": "script:light-delay-main-short" },
        { "kind": "continuity_ledger", "id": "script:light-delay-festival" },
        { "kind": "continuity_ledger", "id": "script:light-delay-trailer" },
        { "kind": "continuity_ledger", "id": "script:light-delay-long" },
        { "kind": "archive", "id": "archive:main-short-unplaced-action-cues" },
        { "kind": "static_file", "id": "data/production/checklists/higgsfield-pre-subscribe.json" },
        { "kind": "static_file", "id": "docs/production/HIGGSFIELD_PRE_SUBSCRIBE_CHECKLIST.md" },
        { "kind": "static_file", "id": "docs/PRODUCTION_PLAN.md" },
        { "kind": "static_file", "id": "docs/PLAN_SINCRONIZACION_ANIMATICS.md" },
        { "kind": "static_file", "id": "docs/EDICION_ESCENA_LASER_Y_RITMO_DIALOGO.md" },
        { "kind": "static_file", "id": "docs/Light Delay — Tráiler de la versión de 30 minutos.md" },
        { "kind": "static_file", "id": "docs/light-delay-festival-cut-adaptation.md" },
        { "kind": "static_file", "id": "docs/REVISION_LARGOMETRAJE_RECUPERADO.md" },
        { "kind": "static_file", "id": "docs/REVISION_TRABAJO_OTRO_AGENTE.md" }
      ]
    },
    {
      "id": "lifecycle:master-required-entities",
      "status": "active",
      "relevance": "required",
      "disposition": "retain",
      "reason": {
        "es": "Entidad nombrada o requerida directamente por la escaleta maestra.",
        "en": "Entity directly named or required by the master outline."
      },
      "refs": [
        { "kind": "entity", "id": "character:zao" },
        { "kind": "entity", "id": "character:voss" },
        { "kind": "entity", "id": "character:harlan" },
        { "kind": "entity", "id": "character:rao" },
        { "kind": "entity", "id": "character:sorell" },
        { "kind": "entity", "id": "character:okoye" },
        { "kind": "entity", "id": "location:proxima-station" },
        { "kind": "entity", "id": "location:proxima-dock" },
        { "kind": "entity", "id": "location:celestial-ardor-bridge" },
        { "kind": "entity", "id": "location:celestial-ardor-command-vestibule" },
        { "kind": "entity", "id": "location:celestial-ardor-central-access" },
        { "kind": "entity", "id": "location:celestial-ardor-service-cylinder" },
        { "kind": "entity", "id": "location:celestial-ardor-engineering" },
        { "kind": "entity", "id": "location:velari-wormhole-mouth" },
        { "kind": "entity", "id": "location:velari-station" },
        { "kind": "entity", "id": "object:optical-contingency-transmitter" },
        { "kind": "entity", "id": "object:wired-comms-deck-patch-panel" },
        { "kind": "entity", "id": "vehicle:celestial-ardor" },
        { "kind": "entity", "id": "faction:human" },
        { "kind": "entity", "id": "faction:velari" },
        { "kind": "entity_variant", "id": "variant:okoye-master-wip" },
        { "kind": "asset", "id": "asset:character-okoye-sheet" },